"ID","Type","Description","Commit","Size/Commit","Others"
"70","Extract Method","Extract Method protected getCountQuery(spec Specification<T>, mode QueryMode) : TypedQuery<Long> extracted from protected getCountQuery(spec Specification<T>) : TypedQuery<Long> in class org.springframework.data.jpa.repository.support.SimpleJpaRepository","https://github.com/apache/hive/commit/d69e5cb21c04d9eede314aaa9ad059fc603fb025","3","Move Attribute private tag : byte from class org.apache.hadoop.hive.ql.exec.SparkHashTableSinkOperator to private tag : byte from class org.apache.hadoop.hive.ql.plan.SparkHashTableSinkDesc
Move Method public setTag(tag byte) : void from class org.apache.hadoop.hive.ql.exec.SparkHashTableSinkOperator to public setTag(tag byte) : void from class org.apache.hadoop.hive.ql.plan.SparkHashTableSinkDesc
Extract Method protected getCountQuery(spec Specification<T>, mode QueryMode) : TypedQuery<Long> extracted from protected getCountQuery(spec Specification<T>) : TypedQuery<Long> in class org.springframework.data.jpa.repository.support.SimpleJpaRepository"
"71","Extract Method","Extract Method private fileSelection() : File extracted from public actionPerformed(e ActionEvent) : void in class org.neo4j.desktop.ui.BrowseForDatabaseActionListener","https://github.com/neo4j/neo4j/commit/d1a6ae2a16ba1d53b1de02eea8745d67c6a1a005","4","Extract Method private fileSelection() : File extracted from public actionPerformed(e ActionEvent) : void in class org.neo4j.desktop.ui.BrowseForDatabaseActionListener
Rename Variable jFileChooser : JFileChooser to fileChooser : JFileChooser in method private fileSelection() : File in class org.neo4j.desktop.ui.BrowseForDatabaseActionListener
Extract Variable location : String in method public MainWindow(databaseActions DatabaseActions, model DesktopModel) from class org.neo4j.desktop.ui.MainWindow
Rename Variable error : UnsuitableDirectoryException to ude : UnsuitableDirectoryException in method public actionPerformed(e ActionEvent) : void in class org.neo4j.desktop.ui.BrowseForDatabaseActionListener"
"72","Extract Method","Extract Method private startAsync() : void extracted from public start() : void in class com.android.systemui.usb.StorageNotification","https://github.com/CyanogenMod/android_frameworks_base/commit/4587c32ab8a1c8e2169e4f93491a8c927216a6ab","1","Extract Method private startAsync() : void extracted from public start() : void in class com.android.systemui.usb.StorageNotification"
"73","Extract Method","Extract Method private standaloneCollect(cli CLI, protocol String, host String, port int) : void extracted from public main(args String[]) : void in class org.jboss.as.jdr.CommandLineMain","https://github.com/wildfly/wildfly/commit/c0f8a7f2b4341601df63c5470f41f157dbd83781","4","Extract Method private standaloneCollect(cli CLI, protocol String, host String, port int) : void extracted from public main(args String[]) : void in class org.jboss.as.jdr.CommandLineMain
Change Parameter Type port : String to port : int in method public JdrRunner(cli CLI, protocol String, host String, port int, user String, pass String) in class org.jboss.as.jdr.JdrRunner
Add Method Annotation @Override in method public collect() : JdrReport from class org.jboss.as.jdr.JdrRunner
Add Parameter cli : CLI in method public JdrRunner(cli CLI, protocol String, host String, port int, user String, pass String) from class org.jboss.as.jdr.JdrRunner"
"74","Extract Method","Extract Method public loadGoogleModel(modelFile File, binary boolean, lineBreaks boolean) : Word2Vec extracted from public loadGoogleModel(modelFile File, binary boolean) : Word2Vec in class org.deeplearning4j.models.embeddings.loader.WordVectorSerializer","https://github.com/deeplearning4j/deeplearning4j/commit/3325f5ccd23f8016fa28a24f878b54f1918546ed","2","Extract Method public loadGoogleModel(modelFile File, binary boolean, lineBreaks boolean) : Word2Vec extracted from public loadGoogleModel(modelFile File, binary boolean) : Word2Vec in class org.deeplearning4j.models.embeddings.loader.WordVectorSerializer
Add Parameter linebreaks : boolean in method private readBinaryModel(modelFile File, linebreaks boolean) : Word2Vec from class org.deeplearning4j.models.embeddings.loader.WordVectorSerializer"
"75","Extract Method","Extract Method public setMedia(slide Slide, masterSecret MasterSecret) : void extracted from public setMedia(slide Slide) : void in class org.thoughtcrime.securesms.mms.AttachmentManager","https://github.com/WhisperSystems/Signal-Android/commit/c4a37e38aba926c2bef27e4fc00e3a4848ce46bd","5","Extract Method public setMedia(slide Slide, masterSecret MasterSecret) : void extracted from public setMedia(slide Slide) : void in class org.thoughtcrime.securesms.mms.AttachmentManager
Rename Method private constructPartFromUri(uri Uri) : PduPart renamed to private constructPartFromByteArrayAndUri(uri Uri, data byte[], encrypted boolean) : PduPart in class org.thoughtcrime.securesms.mms.ImageSlide
Extract Variable draftType : String in method private getDraftsForCurrentState() : Drafts from class org.thoughtcrime.securesms.ConversationActivity
Add Parameter data : byte[] in method private constructPartFromByteArrayAndUri(uri Uri, data byte[], encrypted boolean) : PduPart from class org.thoughtcrime.securesms.mms.ImageSlide
Add Parameter encrypted : boolean in method private constructPartFromByteArrayAndUri(uri Uri, data byte[], encrypted boolean) : PduPart from class org.thoughtcrime.securesms.mms.ImageSlide"
"76","Extract Method","Extract Method private craftIntent(context Context, intentAction String, extras Bundle) : PendingIntent extracted from public getMarkAsReadIntent(context Context, masterSecret MasterSecret) : PendingIntent in class org.thoughtcrime.securesms.notifications.NotificationState","https://github.com/WhisperSystems/Signal-Android/commit/f0b2cc559026871c1b4d8e008666afb590553004","2","Extract Method private craftIntent(context Context, intentAction String, extras Bundle) : PendingIntent extracted from public getMarkAsReadIntent(context Context, masterSecret MasterSecret) : PendingIntent in class org.thoughtcrime.securesms.notifications.NotificationState
Extract Variable replyAction : Action in method private sendSingleThreadNotification(context Context, masterSecret MasterSecret, notificationState NotificationState, signal boolean) : void from class org.thoughtcrime.securesms.notifications.MessageNotifier"
"77","Extract Method","Extract Method private updateTextViews() : void extracted from public onCreate(savedInstanceState Bundle) : void in class com.novoda.demo.encryption.EncryptionActivity","https://github.com/novoda/android-demos/commit/5cdabae35f0642e9fe243afe12e4c16b3378a150","4","Move Class com.novoda.Base64DecoderException moved to com.novoda.demo.encryption.Base64DecoderException
Move Class com.novoda.Base64 moved to com.novoda.demo.encryption.Base64
Move And Rename Class com.novoda.Encrypt moved and renamed to com.novoda.demo.encryption.EncryptionActivity
Extract Method private updateTextViews() : void extracted from public onCreate(savedInstanceState Bundle) : void in class com.novoda.demo.encryption.EncryptionActivity"
"78","Extract Method","Extract Method public migration(dao Dao, klass Class<?>, add boolean, del boolean, tableName Object) : void extracted from public migration(dao Dao, klass Class<?>, add boolean, del boolean) : void in class org.nutz.dao.util.Daos","https://github.com/nutzam/nutz/commit/de7efe40dad0f4bb900c4fffa80ed377745532b3","1","Extract Method public migration(dao Dao, klass Class<?>, add boolean, del boolean, tableName Object) : void extracted from public migration(dao Dao, klass Class<?>, add boolean, del boolean) : void in class org.nutz.dao.util.Daos"
"79","Extract Method","Extract Method public getUTXOs(outPoints List<TransactionOutPoint>, includeMempool boolean) : ListenableFuture<UTXOsMessage> extracted from public getUTXOs(outPoints List<TransactionOutPoint>) : ListenableFuture<UTXOsMessage> in class org.bitcoinj.core.Peer","https://github.com/bitcoinj/bitcoinj/commit/95bfa40630e34f6f369e0055d9f37f49bca60247","1","Extract Method public getUTXOs(outPoints List<TransactionOutPoint>, includeMempool boolean) : ListenableFuture<UTXOsMessage> extracted from public getUTXOs(outPoints List<TransactionOutPoint>) : ListenableFuture<UTXOsMessage> in class org.bitcoinj.core.Peer"
"80","Extract Method","Extract Method public saveResource(relativePath Path, content byte[]) : void extracted from public save(bytecode byte[]) : void in class net.orfjackal.retrolambda.files.ClassSaver","https://github.com/orfjackal/retrolambda/commit/46b0d84de9c309bca48a99e572e6611693ed5236","3","Extract Method public saveResource(relativePath Path, content byte[]) : void extracted from public save(bytecode byte[]) : void in class net.orfjackal.retrolambda.files.ClassSaver
Rename Method public save(bytecode byte[]) : void renamed to public saveClass(bytecode byte[]) : void in class net.orfjackal.retrolambda.files.ClassSaver
Rename Parameter inputFile : Path to file : Path in method public visitFile(file Path, attrs BasicFileAttributes) : FileVisitResult in class net.orfjackal.retrolambda.files.BytecodeFileVisitor"
"81","Extract Method","Extract Method private getTreePath(components List<String>, escapePathSep boolean) : TreePath extracted from private stringToPath(pathString String) : TreePath in class jetbrains.mps.ide.ui.tree.MPSTree","https://github.com/JetBrains/MPS/commit/7b5622d41537315710b6fd57b2739a3a64698375","3","Extract Method private getTreePath(components List<String>, escapePathSep boolean) : TreePath extracted from private stringToPath(pathString String) : TreePath in class jetbrains.mps.ide.ui.tree.MPSTree
Change Variable Type components : String[] to components : List<String> in method private stringToPath(pathString String) : TreePath in class jetbrains.mps.ide.ui.tree.MPSTree
Extract Variable treeNodeId : String in method private getTreePath(components List<String>, escapePathSep boolean) : TreePath from class jetbrains.mps.ide.ui.tree.MPSTree"
"82","Extract Method","Extract Method private getCustomRoutingCol() : ColumnIdent extracted from private getRoutingCol() : ColumnIdent in class io.crate.metadata.doc.DocIndexMetaData","https://github.com/crate/crate/commit/563d281b61e9f8748858e911eaa810e981f1e953","5","Extract Method private getCustomRoutingCol() : ColumnIdent extracted from private getRoutingCol() : ColumnIdent in class io.crate.metadata.doc.DocIndexMetaData
Rename Method private validateNoUnsupportedFields(function Function, context Context) : String renamed to private rewriteAndValidateFields(function Function, context Context) : Function in class io.crate.lucene.LuceneQueryBuilder.Visitor
Rename Method public testSelectById() : void renamed to public testSelectByIdWithCustomRouting() : void in class io.crate.analyze.where.WhereClauseAnalyzerTest
Inline Variable columnName : String in method private validateNoUnsupportedFields(function Function, context Context) : String from class io.crate.lucene.LuceneQueryBuilder.Visitor
Change Return Type String to Function in method private rewriteAndValidateFields(function Function, context Context) : Function in class io.crate.lucene.LuceneQueryBuilder.Visitor"
"83","Extract Method","Extract Method private dumpConfig(conf Configuration, sb StringBuilder) : void extracted from private dumpEnvironent() : String in class org.apache.hive.hcatalog.templeton.AppConfig","https://github.com/apache/hive/commit/f664789737d516ac664462732664121acc111a1e","1","Extract Method private dumpConfig(conf Configuration, sb StringBuilder) : void extracted from private dumpEnvironent() : String in class org.apache.hive.hcatalog.templeton.AppConfig"
"84","Extract Method","Extract Method protected launchTask(request SingularityRequest, deploy SingularityDeploy, launchTime long, updateTime long, instanceNo int, initialTaskState TaskState) : SingularityTask extracted from protected launchTask(request SingularityRequest, deploy SingularityDeploy, launchTime long, instanceNo int, initialTaskState TaskState) : SingularityTask in class com.hubspot.singularity.SingularitySchedulerTestBase","https://github.com/HubSpot/Singularity/commit/944aea445051891280a8ab7fbbd514c19646f1ab","3","Extract Method protected launchTask(request SingularityRequest, deploy SingularityDeploy, launchTime long, updateTime long, instanceNo int, initialTaskState TaskState) : SingularityTask extracted from protected launchTask(request SingularityRequest, deploy SingularityDeploy, launchTime long, instanceNo int, initialTaskState TaskState) : SingularityTask in class com.hubspot.singularity.SingularitySchedulerTestBase
Rename Parameter launchTime : long to taskLaunch : long in method protected launchTask(request SingularityRequest, deploy SingularityDeploy, taskLaunch long, instanceNo int, initialTaskState TaskState) : SingularityTask in class com.hubspot.singularity.SingularitySchedulerTestBase
Add Parameter isDeployPending : boolean in method private getHealthcheckDeployState(deploy SingularityDeploy, matchingActiveTasks Collection<SingularityTaskId>, isDeployPending boolean) : DeployHealth from class com.hubspot.singularity.scheduler.SingularityDeployHealthHelper"
"85","Extract Method","Extract Method private addAnnotationProcessorOption(compilerArg String, optionsMap Map<String,String>) : void extracted from private getAnnotationProcessorOptionsFromCompilerConfig(compilerConfig Element) : Map<String,String> in class org.jetbrains.idea.maven.project.MavenProject","https://github.com/JetBrains/intellij-community/commit/e1625136ba12907696ef4c6e922ce073293f3a2c","3","Extract Method private addAnnotationProcessorOption(compilerArg String, optionsMap Map<String,String>) : void extracted from private getAnnotationProcessorOptionsFromCompilerConfig(compilerConfig Element) : Map<String,String> in class org.jetbrains.idea.maven.project.MavenProject
Parameterize Variable param : String to compilerArg : String in method private addAnnotationProcessorOption(compilerArg String, optionsMap Map<String,String>) : void in class org.jetbrains.idea.maven.project.MavenProject
Parameterize Variable res : Map<String,String> to optionsMap : Map<String,String> in method private addAnnotationProcessorOption(compilerArg String, optionsMap Map<String,String>) : void in class org.jetbrains.idea.maven.project.MavenProject"
"86","Extract Method","Extract Method private doTestMissingClass(tempDir File) : void extracted from public testMissingClass() : void in class com.google.auto.value.processor.AutoAnnotationCompilationTest","https://github.com/google/auto/commit/8967e7c33c59e1336e1e3b4671293ced5697fca6","1","Extract Method private doTestMissingClass(tempDir File) : void extracted from public testMissingClass() : void in class com.google.auto.value.processor.AutoAnnotationCompilationTest"
"87","Extract Method","Extract Method package run0(client HeliosClient, out PrintStream, json boolean, name String, full boolean) : int extracted from package run(options Namespace, client HeliosClient, out PrintStream, json boolean, stdin BufferedReader) : int in class com.spotify.helios.cli.command.DeploymentGroupStatusCommand","https://github.com/spotify/helios/commit/da39bfeb9c370abe2d86e6e327fade252434090d","5","Extract Method package run0(client HeliosClient, out PrintStream, json boolean, name String, full boolean) : int extracted from package run(options Namespace, client HeliosClient, out PrintStream, json boolean, stdin BufferedReader) : int in class com.spotify.helios.cli.command.DeploymentGroupStatusCommand
Inline Method package watchDeploymentGroup(out PrintStream, name String, interval int, clients List<TargetAndClient>) : void inlined to package run(options Namespace, client HeliosClient, out PrintStream, json boolean, stdin BufferedReader) : int in class com.spotify.helios.cli.command.DeploymentGroupWatchCommand
Rename Parameter clients : List<TargetAndClient> to client : HeliosClient in method package run(options Namespace, client HeliosClient, out PrintStream, json boolean, stdin BufferedReader) : int in class com.spotify.helios.cli.command.DeploymentGroupWatchCommand
Change Parameter Type clients : List<TargetAndClient> to client : HeliosClient in method package run(options Namespace, client HeliosClient, out PrintStream, json boolean, stdin BufferedReader) : int in class com.spotify.helios.cli.command.DeploymentGroupWatchCommand
Extract Attribute private DATE_TIME_PATTERN : String in class com.spotify.helios.cli.command.DeploymentGroupWatchCommand"
"88","Extract Method","Extract Method private matchOverflow(structure char[]) : boolean extracted from public read(cbuf char[], off int, len int) : int in class org.thymeleaf.templateparser.reader.BlockAwareReader","https://github.com/thymeleaf/thymeleaf/commit/378ba37750a9cb1b19a6db434dfa59308f721ea6","1","Extract Method private matchOverflow(structure char[]) : boolean extracted from public read(cbuf char[], off int, len int) : int in class org.thymeleaf.templateparser.reader.BlockAwareReader"
"89","Extract Method","Extract Method private getCandidateDirInTier(tier StorageTier, blockSize long) : StorageDir extracted from public allocateBlock(userId long, blockId long, blockSize long, location BlockStoreLocation) : TempBlockMeta in class tachyon.worker.block.allocator.MaxFreeAllocator","https://github.com/Alluxio/alluxio/commit/9aeefcd8120bb3b89cdb437d8c32d2ed84b8a825","1","Extract Method private getCandidateDirInTier(tier StorageTier, blockSize long) : StorageDir extracted from public allocateBlock(userId long, blockId long, blockSize long, location BlockStoreLocation) : TempBlockMeta in class tachyon.worker.block.allocator.MaxFreeAllocator"
"90","Extract Method","Extract Method private storeCamelContextInQuartzContext() : SchedulerContext extracted from private createAndInitScheduler() : void in class org.apache.camel.component.quartz2.QuartzComponent","https://github.com/apache/camel/commit/cb0935e3af05b333b5c85a4fb3b1846836218f11","1","Extract Method private storeCamelContextInQuartzContext() : SchedulerContext extracted from private createAndInitScheduler() : void in class org.apache.camel.component.quartz2.QuartzComponent"
"91","Extract Method","Extract Method public clearFailedUnlockAttempts(clearFingers boolean) : void extracted from public clearFailedUnlockAttempts() : void in class com.android.keyguard.KeyguardUpdateMonitor","https://github.com/CyanogenMod/android_frameworks_base/commit/76331570e68446c17e4ff5287f5b7b2b6b472895","1","Extract Method public clearFailedUnlockAttempts(clearFingers boolean) : void extracted from public clearFailedUnlockAttempts() : void in class com.android.keyguard.KeyguardUpdateMonitor"
"92","Extract Method","Extract Method protected getFromNearCache(keyData Data, async boolean) : Object extracted from protected getInternal(key K, expiryPolicy ExpiryPolicy, async boolean) : Object in class com.hazelcast.client.cache.impl.AbstractClientCacheProxy","https://github.com/hazelcast/hazelcast/commit/679d38d4316c16ccba4982d7f3ba13c147a451cb","3","Extract Method protected getFromNearCache(keyData Data, async boolean) : Object extracted from protected getInternal(key K, expiryPolicy ExpiryPolicy, async boolean) : Object in class com.hazelcast.client.cache.impl.AbstractClientCacheProxy
Rename Variable newPut : boolean to oldRecord : R in method public put(key K, value V) : void in class com.hazelcast.cache.impl.nearcache.impl.store.AbstractNearCacheRecordStore
Change Variable Type newPut : boolean to oldRecord : R in method public put(key K, value V) : void in class com.hazelcast.cache.impl.nearcache.impl.store.AbstractNearCacheRecordStore"
"93","Extract Method","Extract Method private getDeploymentGroup(client ZooKeeperClient, name String) : DeploymentGroup extracted from public getDeploymentGroup(name String) : DeploymentGroup in class com.spotify.helios.master.ZooKeeperMasterModel","https://github.com/spotify/helios/commit/dd8753cfb0f67db4dde6c5254e2df3104b635dae","4","Extract Method private getDeploymentGroup(client ZooKeeperClient, name String) : DeploymentGroup extracted from public getDeploymentGroup(name String) : DeploymentGroup in class com.spotify.helios.master.ZooKeeperMasterModel
Rename Method public configDeploymentGroups(name String) : String renamed to public configDeploymentGroup(name String) : String in class com.spotify.helios.servicescommon.coordination.Paths
Add Parameter deploymentGroup : DeploymentGroup in method private deployJobRetry(client ZooKeeperClient, host String, deployment Deployment, count int, token String, deploymentGroup DeploymentGroup) : void from class com.spotify.helios.master.ZooKeeperMasterModel
Add Parameter masterModel : MasterModel in method public RollingUpdateService(masterModel MasterModel, reactorFactory ReactorFactory) from class com.spotify.helios.rollingupdate.RollingUpdateService"
"94","Extract Method","Extract Method private onUserLoggedIn(uri Uri) : void extracted from protected onNewIntent(intent Intent) : void in class com.github.mobile.accounts.LoginActivity","https://github.com/github/android/commit/a7401e5091c06c68fae499ea1972b40143c66fa9","3","Extract Method private onUserLoggedIn(uri Uri) : void extracted from protected onNewIntent(intent Intent) : void in class com.github.mobile.accounts.LoginActivity
Rename Method private endAccess(accessToken String, scope String) : void renamed to private endAuth(accessToken String, scope String) : void in class com.github.mobile.accounts.LoginActivity
Rename Variable chooser : Intent to intent : Intent in method private openLoginInBrowser(client ApiClient) : void in class com.github.mobile.accounts.LoginActivity"
"95","Extract Method","Extract Method public readCaffeModel(is InputStream, sizeLimitMb int) : NetParameter extracted from public readCaffeModel(caffeModelPath String, sizeLimitMb int) : NetParameter in class org.deeplearning4j.translate.CaffeModelToJavaClass","https://github.com/deeplearning4j/deeplearning4j/commit/3d080545362794ac5ab63a6cf1bdfb523a0d92a5","1","Extract Method public readCaffeModel(is InputStream, sizeLimitMb int) : NetParameter extracted from public readCaffeModel(caffeModelPath String, sizeLimitMb int) : NetParameter in class org.deeplearning4j.translate.CaffeModelToJavaClass"
"96","Extract Method","Extract Method package handleObject(nodeFactory NodeFactory, relFactory RelationshipFactory, key String, value Object, includeHiddenAndDeleted boolean, publicOnly boolean, level int) : Object extracted from public execute(query String, parameters Map<String,Object>, includeHiddenAndDeleted boolean, publicOnly boolean) : List<GraphObject> in class org.structr.core.graph.CypherQueryCommand","https://github.com/structr/structr/commit/15afd616cba5fb3d432d11a6de0d4f7805b202db","5","Extract Method package handleObject(nodeFactory NodeFactory, relFactory RelationshipFactory, key String, value Object, includeHiddenAndDeleted boolean, publicOnly boolean, level int) : Object extracted from public execute(query String, parameters Map<String,Object>, includeHiddenAndDeleted boolean, publicOnly boolean) : List<GraphObject> in class org.structr.core.graph.CypherQueryCommand
Extract Variable type : Class in method public instantiate(node Node) : T from class org.structr.core.graph.NodeFactory
Extract Variable type : Class in method public instantiate(relationship Relationship) : T from class org.structr.core.graph.RelationshipFactory
Inline Variable graphDb : GraphDatabaseService in method public getRelationshipById(uuid String) : RelationshipInterface from class org.structr.core.app.StructrApp
Inline Variable graphDb : GraphDatabaseService in method public getNodeById(uuid String) : NodeInterface from class org.structr.core.app.StructrApp"
"97","Extract Method","Extract Method private isNavigationBlocked(renderer GutterIconRenderer, project Project) : boolean extracted from public mouseReleased(e MouseEvent) : void in class com.intellij.openapi.editor.impl.EditorGutterComponentImpl","https://github.com/JetBrains/intellij-community/commit/af618666043f21b3db7e6a1be2aa225ae0f432b4","1","Extract Method private isNavigationBlocked(renderer GutterIconRenderer, project Project) : boolean extracted from public mouseReleased(e MouseEvent) : void in class com.intellij.openapi.editor.impl.EditorGutterComponentImpl"
"98","Extract Method","Extract Method public createExpressionMessageMetadataSource(matcherToExpression LinkedHashMap<MessageMatcher<?>,String>, handler SecurityExpressionHandler<Message<Object>>) : MessageSecurityMetadataSource extracted from public createExpressionMessageMetadataSource(matcherToExpression LinkedHashMap<MessageMatcher<?>,String>) : MessageSecurityMetadataSource in class org.springframework.security.messaging.access.expression.ExpressionBasedMessageSecurityMetadataSourceFactory","https://github.com/spring-projects/spring-security/commit/64938ebcfc2fc8cd9ccd6cf31dbcd8cdd0660aca","2","Extract Method public createExpressionMessageMetadataSource(matcherToExpression LinkedHashMap<MessageMatcher<?>,String>, handler SecurityExpressionHandler<Message<Object>>) : MessageSecurityMetadataSource extracted from public createExpressionMessageMetadataSource(matcherToExpression LinkedHashMap<MessageMatcher<?>,String>) : MessageSecurityMetadataSource in class org.springframework.security.messaging.access.expression.ExpressionBasedMessageSecurityMetadataSourceFactory
Extract Variable voter : MessageExpressionVoter<Object> in method public inboundChannelSecurity() : ChannelSecurityInterceptor from class org.springframework.security.config.annotation.web.socket.AbstractSecurityWebSocketMessageBrokerConfigurer"
