"ID","Type","Description","Commit","Size/Commit","Others"
"99","Extract Method","Extract Method private allTopLevelNodes() : List<MenuNode> extracted from public topLevelNodes() : List<MenuNode> in class org.geometerplus.android.fbreader.MenuData","https://github.com/geometer/FBReaderJ/commit/42e0649f82779ecd48bff6448924fc7dc2534554","3","Extract Method private allTopLevelNodes() : List<MenuNode> extracted from public topLevelNodes() : List<MenuNode> in class org.geometerplus.android.fbreader.MenuData
Extract Variable onResource : ZLResource in method protected ZLCheckBoxPreference(context Context, resource ZLResource) from class org.geometerplus.android.fbreader.preferences.ZLCheckBoxPreference
Extract Variable offResource : ZLResource in method protected ZLCheckBoxPreference(context Context, resource ZLResource) from class org.geometerplus.android.fbreader.preferences.ZLCheckBoxPreference"
"100","Extract Method","Extract Method protected flushPersistentObjects(persistentObjectClass Class<? extends PersistentObject>, persistentObjectsToInsert List<PersistentObject>) : void extracted from protected flushInserts() : void in class org.activiti.engine.impl.db.DbSqlSession","https://github.com/Activiti/Activiti/commit/a70ca1d9ad2ea07b19c5e1f9540c809d7a12d3fb","3","Extract Method protected flushPersistentObjects(persistentObjectClass Class<? extends PersistentObject>, persistentObjectsToInsert List<PersistentObject>) : void extracted from protected flushInserts() : void in class org.activiti.engine.impl.db.DbSqlSession
Rename Variable clazz : Class<? extends PersistentObject> to persistentObjectClass : Class<? extends PersistentObject> in method protected flushInserts() : void in class org.activiti.engine.impl.db.DbSqlSession
Parameterize Variable clazz : Class<? extends PersistentObject> to persistentObjectClass : Class<? extends PersistentObject> in method protected flushPersistentObjects(persistentObjectClass Class<? extends PersistentObject>, persistentObjectsToInsert List<PersistentObject>) : void in class org.activiti.engine.impl.db.DbSqlSession"
"101","Extract Method","Extract Method protected getEntityForm(info DynamicEntityFormInfo, dynamicFormOverride EntityForm) : EntityForm extracted from protected getBlankDynamicFieldTemplateForm(info DynamicEntityFormInfo, dynamicFormOverride EntityForm) : EntityForm in class org.broadleafcommerce.openadmin.web.controller.AdminAbstractController","https://github.com/BroadleafCommerce/BroadleafCommerce/commit/9687048f76519fc89b4151cbe2841bbba61a401d","1","Extract Method protected getEntityForm(info DynamicEntityFormInfo, dynamicFormOverride EntityForm) : EntityForm extracted from protected getBlankDynamicFieldTemplateForm(info DynamicEntityFormInfo, dynamicFormOverride EntityForm) : EntityForm in class org.broadleafcommerce.openadmin.web.controller.AdminAbstractController"
"102","Extract Method","Extract Method protected addInterceptor(interceptor Interceptor, store boolean) : void extracted from public addInterceptor(interceptor Interceptor) : void in class org.drools.persistence.SingleSessionCommandService","https://github.com/droolsjbpm/drools/commit/7ffc62aa554f5884064b81ee80078e35e3833006","1","Extract Method protected addInterceptor(interceptor Interceptor, store boolean) : void extracted from public addInterceptor(interceptor Interceptor) : void in class org.drools.persistence.SingleSessionCommandService"
"103","Extract Method","Extract Method private signFrameworks(appDir File, getTaskAllow boolean) : void extracted from protected prepareLaunch(appDir File) : void in class org.robovm.compiler.target.ios.IOSTarget","https://github.com/robovm/robovm/commit/7837d0baf1aef45340eec699516a8c3a22aeb553","1","Extract Method private signFrameworks(appDir File, getTaskAllow boolean) : void extracted from protected prepareLaunch(appDir File) : void in class org.robovm.compiler.target.ios.IOSTarget"
"104","Extract Method","Extract Method private fillWithScopeExpansion(elements Set<Object>, pattern String) : boolean extracted from public computeInReadAction(indicator ProgressIndicator) : void in class com.intellij.ide.util.gotoByName.ChooseByNameBase.CalcElementsThread","https://github.com/JetBrains/intellij-community/commit/619a6012da868d0d42d9628460f2264effe9bdba","2","Extract Method private fillWithScopeExpansion(elements Set<Object>, pattern String) : boolean extracted from public computeInReadAction(indicator ProgressIndicator) : void in class com.intellij.ide.util.gotoByName.ChooseByNameBase.CalcElementsThread
Remove Parameter scopeExpanded : boolean in method package CalcElementsThread(pattern String, checkboxState boolean, callback Consumer<Set<?>>, modalityState ModalityState, scopeExpanded boolean) from class com.intellij.ide.util.gotoByName.ChooseByNameBase.CalcElementsThread"
"105","Extract Method","Extract Method public getLibraryPaths() : List<String> extracted from public getLibraryPath() : String in class com.intellij.execution.junit.JUnit4Framework","https://github.com/JetBrains/intellij-community/commit/10f769a60c7c7b73982e978959d381df487bbe2d","2","Move Method private getJUnit4JarPaths() : List<String> from class com.intellij.codeInsight.daemon.impl.quickfix.OrderEntryFix to public getJUnit4JarPaths() : List<String> from class com.intellij.openapi.projectRoots.ex.JavaSdkUtil
Extract Method public getLibraryPaths() : List<String> extracted from public getLibraryPath() : String in class com.intellij.execution.junit.JUnit4Framework"
"106","Extract Method","Extract Method private toCanonicalPath(path String, separatorChar char, removeLastSlash boolean, resolveSymlinksIfNecessary boolean) : String extracted from private toCanonicalPath(path String, separatorChar char, removeLastSlash boolean) : String in class com.intellij.openapi.util.io.FileUtil","https://github.com/JetBrains/intellij-community/commit/a9379ee529ed87e28c0736c3c6657dcd6a0680e4","5","Extract Method private toCanonicalPath(path String, separatorChar char, removeLastSlash boolean, resolveSymlinksIfNecessary boolean) : String extracted from private toCanonicalPath(path String, separatorChar char, removeLastSlash boolean) : String in class com.intellij.openapi.util.io.FileUtil
Change Return Type void to boolean in method private processDots(result StringBuilder, dots int, start int, resolveSymlinksIfNecessary boolean) : boolean in class com.intellij.openapi.util.io.FileUtil
Add Method Annotation @Contract(""_, _, _, false -> true"") in method private processDots(result StringBuilder, dots int, start int, resolveSymlinksIfNecessary boolean) : boolean from class com.intellij.openapi.util.io.FileUtil
Add Parameter resolveSymlinksIfNecessary : boolean in method private processDots(result StringBuilder, dots int, start int, resolveSymlinksIfNecessary boolean) : boolean from class com.intellij.openapi.util.io.FileUtil
Add Parameter Annotation @NotNull in parameter result : StringBuilder in method private processDots(result StringBuilder, dots int, start int, resolveSymlinksIfNecessary boolean) : boolean from class com.intellij.openapi.util.io.FileUtil"
"107","Extract Method","Extract Method private createSymLinkSdks(sdks Iterable<String>, root Path, version String) : void extracted from private createSymLinkIosSdks(root Path, version String) : void in class com.facebook.buck.apple.AppleSdkDiscoveryTest","https://github.com/facebook/buck/commit/52cfd39ecba349c4d8e2c46eac76ed4d75b7ebae","3","Extract Method private createSymLinkSdks(sdks Iterable<String>, root Path, version String) : void extracted from private createSymLinkIosSdks(root Path, version String) : void in class com.facebook.buck.apple.AppleSdkDiscoveryTest
Rename Method public simulatorPlatformSetsLinkerFlags() : void renamed to public iphoneOSSimulatorPlatformSetsLinkerFlags() : void in class com.facebook.buck.apple.AppleCxxPlatformsTest
Rename Method public appleSdkPathsBuiltFromDirectory() : void renamed to public iphoneOSSdkPathsBuiltFromDirectory() : void in class com.facebook.buck.apple.AppleCxxPlatformsTest"
"108","Extract Method","Extract Method private hepPlan(basePlan RelNode, followPlanChanges boolean, mdProvider RelMetadataProvider, order HepMatchOrder, rules RelOptRule...) : RelNode extracted from private hepPlan(basePlan RelNode, followPlanChanges boolean, mdProvider RelMetadataProvider, rules RelOptRule...) : RelNode in class org.apache.hadoop.hive.ql.parse.CalcitePlanner.CalcitePlannerAction","https://github.com/apache/hive/commit/999e0e3616525d77cf46c5865f9981b5a6b5609a","1","Extract Method private hepPlan(basePlan RelNode, followPlanChanges boolean, mdProvider RelMetadataProvider, order HepMatchOrder, rules RelOptRule...) : RelNode extracted from private hepPlan(basePlan RelNode, followPlanChanges boolean, mdProvider RelMetadataProvider, rules RelOptRule...) : RelNode in class org.apache.hadoop.hive.ql.parse.CalcitePlanner.CalcitePlannerAction"
"109","Extract Method","Extract Method public resolveAndDownloadImpl(project Project, coord String, attachJavaDoc boolean, attachSources boolean, copyTo String, repositories List<MavenRepositoryInfo>) : List<OrderRoot> extracted from public resolveAndDownload(project Project, coord String, attachJavaDoc boolean, attachSources boolean, copyTo String, repositories List<MavenRepositoryInfo>) : NewLibraryConfiguration in class org.jetbrains.idea.maven.utils.library.RepositoryAttachHandler","https://github.com/JetBrains/intellij-community/commit/e1f0dbc2f09541fc64ce88ee22d8f8f4648004fe","2","Extract Method public resolveAndDownloadImpl(project Project, coord String, attachJavaDoc boolean, attachSources boolean, copyTo String, repositories List<MavenRepositoryInfo>) : List<OrderRoot> extracted from public resolveAndDownload(project Project, coord String, attachJavaDoc boolean, attachSources boolean, copyTo String, repositories List<MavenRepositoryInfo>) : NewLibraryConfiguration in class org.jetbrains.idea.maven.utils.library.RepositoryAttachHandler
Change Variable Type result : Ref<NewLibraryConfiguration> to result : Ref<List<OrderRoot>> in method public resolveAndDownloadImpl(project Project, coord String, attachJavaDoc boolean, attachSources boolean, copyTo String, repositories List<MavenRepositoryInfo>) : List<OrderRoot> in class org.jetbrains.idea.maven.utils.library.RepositoryAttachHandler"
"110","Extract Method","Extract Method public checkArrayIndex(index long) : void extracted from public readBlockAndCheckIndex(array Slice, index long) : Block in class com.facebook.presto.operator.scalar.ArraySubscriptOperator","https://github.com/facebook/presto/commit/8b1f5ce432bd6f579c646705d79ff0c4690495ae","1","Extract Method public checkArrayIndex(index long) : void extracted from public readBlockAndCheckIndex(array Slice, index long) : Block in class com.facebook.presto.operator.scalar.ArraySubscriptOperator"
"111","Extract Method","Extract Method private getOptimizer(oa OptimizationAlgorithm, conf NeuralNetConfiguration, m Model) : ConvexOptimizer extracted from public testSphereFnOptHelper(oa OptimizationAlgorithm, numLineSearchIter int, nDimensions int) : void in class org.deeplearning4j.optimize.solver.TestOptimizers","https://github.com/deeplearning4j/deeplearning4j/commit/c50064efb325b0c94cc62788b4c8935b7c39ac40","1","Extract Method private getOptimizer(oa OptimizationAlgorithm, conf NeuralNetConfiguration, m Model) : ConvexOptimizer extracted from public testSphereFnOptHelper(oa OptimizationAlgorithm, numLineSearchIter int, nDimensions int) : void in class org.deeplearning4j.optimize.solver.TestOptimizers"
"112","Extract Method","Extract Method private validateParameters() : void extracted from public prepare(manager MappingManager, ps PreparedStatement) : void in class com.datastax.driver.mapping.MethodMapper","https://github.com/datastax/java-driver/commit/14abb6919a99a0d6d500198dd2e30c83b1bb6709","4","Extract Method private validateParameters() : void extracted from public prepare(manager MappingManager, ps PreparedStatement) : void in class com.datastax.driver.mapping.MethodMapper
Rename Method package should_include_enumtype_in_accessor_string() : void renamed to public should_allow_enum_as_string_in_accessor_params() : void in class com.datastax.driver.mapping.MapperAccessorParamsTest
Rename Method package should_include_enumtype_in_accessor_ordinal() : void renamed to public should_allow_enum_as_int_in_accessor_params() : void in class com.datastax.driver.mapping.MapperAccessorParamsTest
Extract Variable variables : ColumnDefinitions in method private validateParameters() : void from class com.datastax.driver.mapping.MethodMapper"
"113","Extract Method","Extract Method private setProtectionPassword(password String, hashAlgo HashAlgorithm) : void extracted from public setEnforcementEditValue(editValue STDocProtect, password String, hashAlgo HashAlgorithm) : void in class org.docx4j.openpackaging.parts.WordprocessingML.DocumentSettingsPart","https://github.com/plutext/docx4j/commit/59b8e89e61432d1d8f25cb003b62b3ac004d1b6f","1","Extract Method private setProtectionPassword(password String, hashAlgo HashAlgorithm) : void extracted from public setEnforcementEditValue(editValue STDocProtect, password String, hashAlgo HashAlgorithm) : void in class org.docx4j.openpackaging.parts.WordprocessingML.DocumentSettingsPart"
"114","Extract Method","Extract Method public createExchange(message Message, endpoint Endpoint, keyFormatStrategy KeyFormatStrategy) : Exchange extracted from public createExchange(message Message, endpoint Endpoint) : Exchange in class org.apache.camel.component.sjms.jms.JmsMessageHelper","https://github.com/apache/camel/commit/ab1d1dd78fe53edb50c4ede447e4ac5a55ee2ac9","1","Extract Method public createExchange(message Message, endpoint Endpoint, keyFormatStrategy KeyFormatStrategy) : Exchange extracted from public createExchange(message Message, endpoint Endpoint) : Exchange in class org.apache.camel.component.sjms.jms.JmsMessageHelper"
"115","Extract Method","Extract Method private getFieldInitializerNullness(expression PsiExpression) : Nullness extracted from private calcInherentNullability() : Nullness in class com.intellij.codeInspection.dataFlow.value.DfaVariableValue","https://github.com/JetBrains/intellij-community/commit/1b70adbfd49e00194c4c1170ef65e8114d7a2e46","1","Extract Method private getFieldInitializerNullness(expression PsiExpression) : Nullness extracted from private calcInherentNullability() : Nullness in class com.intellij.codeInspection.dataFlow.value.DfaVariableValue"
"116","Extract Method","Extract Method private isRolloutTimedOut(deploymentGroup DeploymentGroup, client ZooKeeperClient) : boolean extracted from private rollingUpdateAwaitRunning(deploymentGroup DeploymentGroup, host String) : RollingUpdateTaskResult in class com.spotify.helios.master.ZooKeeperMasterModel","https://github.com/spotify/helios/commit/3ffd70929c08be5cf14f156189e8050969caa87e","1","Extract Method private isRolloutTimedOut(deploymentGroup DeploymentGroup, client ZooKeeperClient) : boolean extracted from private rollingUpdateAwaitRunning(deploymentGroup DeploymentGroup, host String) : RollingUpdateTaskResult in class com.spotify.helios.master.ZooKeeperMasterModel"
"117","Extract Method","Extract Method public getItemViewType(message Message) : int extracted from public getItemViewType(position int) : int in class eu.siacs.conversations.ui.adapter.MessageAdapter","https://github.com/siacs/Conversations/commit/e6cb12dfe414497b4317820497985c110cb81864","2","Extract Method public getItemViewType(message Message) : int extracted from public getItemViewType(position int) : int in class eu.siacs.conversations.ui.adapter.MessageAdapter
Extract Variable layoutParams : LinearLayout.LayoutParams in method private displayImageMessage(viewHolder ViewHolder, message Message) : void from class eu.siacs.conversations.ui.adapter.MessageAdapter"
"118","Extract Method","Extract Method private createConfigurable(ep ConfigurableEP<T>, log boolean) : T extracted from public wrapConfigurable(ep ConfigurableEP<T>) : T in class com.intellij.openapi.options.ex.ConfigurableWrapper","https://github.com/JetBrains/intellij-community/commit/7dd55014f9840ce03867bb175cf37a4c151dc806","1","Extract Method private createConfigurable(ep ConfigurableEP<T>, log boolean) : T extracted from public wrapConfigurable(ep ConfigurableEP<T>) : T in class com.intellij.openapi.options.ex.ConfigurableWrapper"
"119","Extract Method","Extract Method public clear() : void extracted from public close() : void in class com.intellij.util.io.CachingEnumerator","https://github.com/JetBrains/intellij-community/commit/9fbf6b852bd9766060307aff960fb597d55e24d3","1","Extract Method public clear() : void extracted from public close() : void in class com.intellij.util.io.CachingEnumerator"
"120","Extract Method","Extract Method public findPsiFile(project Project, path String) : PsiFile extracted from private getElementForNavigationTarget(project Project, target PluginNavigationTarget) : PsiElement in class com.jetbrains.lang.dart.resolve.DartResolver","https://github.com/JetBrains/intellij-plugins/commit/0df7cb00757fe0d4fac8d8b0d5fc46af95feb238","2","Extract Method public findPsiFile(project Project, path String) : PsiFile extracted from private getElementForNavigationTarget(project Project, target PluginNavigationTarget) : PsiElement in class com.jetbrains.lang.dart.resolve.DartResolver
Parameterize Variable targetPath : String to path : String in method public findPsiFile(project Project, path String) : PsiFile in class com.jetbrains.lang.dart.resolve.DartResolver"
"121","Extract Method","Extract Method private removeItemPresentationModelFactoryMethod(dataSetProperties Collection<DataSetPropertyInfoImpl>) : void extracted from private processDataSetProperties() : void in class org.robobinding.codegen.presentationmodel.processor.PresentationModelInfoBuilder","https://github.com/RoboBinding/RoboBinding/commit/b6565814805dfb2d989be25c11d4fb4cf8fb1d84","4","Change Package org.robobinding.codegen.presentationmodel.nestedIPMexample to org.robobinding.codegen.presentationmodel.nestedIPM
Extract Method private removeItemPresentationModelFactoryMethod(dataSetProperties Collection<DataSetPropertyInfoImpl>) : void extracted from private processDataSetProperties() : void in class org.robobinding.codegen.presentationmodel.processor.PresentationModelInfoBuilder
Change Parameter Type dataSetProperty : DataSetPropertyInfoImpl to dataSetProperty : DataSetPropertyInfo in method private removeSetterOfDataSetProperty(dataSetProperty DataSetPropertyInfo) : void in class org.robobinding.codegen.presentationmodel.processor.PresentationModelInfoBuilder
Change Parameter Type dataSetProperty : DataSetPropertyInfoImpl to dataSetProperty : DataSetPropertyInfo in method private removeItemPresentationModelFactoryMethod(dataSetProperty DataSetPropertyInfo) : void in class org.robobinding.codegen.presentationmodel.processor.PresentationModelInfoBuilder"
"122","Extract Method","Extract Method private closeGraphiteConnection() : void extracted from public report(gauges SortedMap<String,Gauge>, counters SortedMap<String,Counter>, histograms SortedMap<String,Histogram>, meters SortedMap<String,Meter>, timers SortedMap<String,Timer>) : void in class com.codahale.metrics.graphite.GraphiteReporter","https://github.com/dropwizard/metrics/commit/4c6ab3d77cc67c7a91155d884077520dcf1509c6","1","Extract Method private closeGraphiteConnection() : void extracted from public report(gauges SortedMap<String,Gauge>, counters SortedMap<String,Counter>, histograms SortedMap<String,Histogram>, meters SortedMap<String,Meter>, timers SortedMap<String,Timer>) : void in class com.codahale.metrics.graphite.GraphiteReporter"
"123","Extract Method","Extract Method private getAllPathsWork(workingDir Path) : ImmutableBiMap<Path,Path> extracted from private getAllPaths(workingDir Optional<Path>) : ImmutableBiMap<Path,Path> in class com.facebook.buck.cxx.DebugPathSanitizer","https://github.com/facebook/buck/commit/a1525ac9a0bb8f727167a8be94c81a3415128ef4","2","Extract Method private getAllPathsWork(workingDir Path) : ImmutableBiMap<Path,Path> extracted from private getAllPaths(workingDir Optional<Path>) : ImmutableBiMap<Path,Path> in class com.facebook.buck.cxx.DebugPathSanitizer
Extract Variable pathToReplace : String in method public sanitize(workingDir Optional<Path>, contents String, expandPaths boolean) : String from class com.facebook.buck.cxx.DebugPathSanitizer"
"124","Extract Method","Extract Method public tryParse(string String, radix int) : Long extracted from public tryParse(string String) : Long in class com.google.common.primitives.Longs","https://github.com/google/guava/commit/31fc19200207ccadc45328037d8a2a62b617c029","5","Move Method private digit(c char) : int from class com.google.common.primitives.Ints to private digit(c char) : int from class com.google.common.primitives.Longs
Extract Method public tryParse(string String, radix int) : Long extracted from public tryParse(string String) : Long in class com.google.common.primitives.Longs
Move Attribute private asciiDigits : byte[] from class com.google.common.primitives.Ints to private asciiDigits : byte[] from class com.google.common.primitives.Longs
Extract And Move Method public tryParse(string String, radix int) : Long extracted from package tryParse(string String, radix int) : Integer in class com.google.common.primitives.Ints & moved to class com.google.common.primitives.Longs
Add Method Annotation @Beta in method public tryParse(string String, radix int) : Integer from class com.google.common.primitives.Ints"
"125","Extract Method","Extract Method public deleteRowAt(metadata CFMetaData, timestamp long, localDeletionTime int, key Object, clusteringValues Object...) : Mutation extracted from public deleteRow(metadata CFMetaData, timestamp long, key Object, clusteringValues Object...) : Mutation in class org.apache.cassandra.db.RowUpdateBuilder","https://github.com/apache/cassandra/commit/2b0a8f6bdac621badabcb9921c077260f2470c26","2","Extract Method public deleteRowAt(metadata CFMetaData, timestamp long, localDeletionTime int, key Object, clusteringValues Object...) : Mutation extracted from public deleteRow(metadata CFMetaData, timestamp long, key Object, clusteringValues Object...) : Mutation in class org.apache.cassandra.db.RowUpdateBuilder
Add Parameter localDeletionTime : int in method private deleteRow(update PartitionUpdate, timestamp long, localDeletionTime int, clusteringValues Object...) : void from class org.apache.cassandra.db.RowUpdateBuilder"
"126","Extract Method","Extract Method private listSnapshots() : List<File> extracted from public getSnapshotDetails() : Map<String,Pair<Long,Long>> in class org.apache.cassandra.db.Directories","https://github.com/apache/cassandra/commit/b70f7ea0ce27b5defa0a7773d448732364e7aee0","3","Extract Method private listSnapshots() : List<File> extracted from public getSnapshotDetails() : Map<String,Pair<Long,Long>> in class org.apache.cassandra.db.Directories
Add Parameter ephemeral : boolean in method public snapshotWithoutFlush(snapshotName String, predicate Predicate<SSTableReader>, ephemeral boolean) : void from class org.apache.cassandra.db.ColumnFamilyStore
Add Parameter ephemeral : boolean in method public snapshot(snapshotName String, predicate Predicate<SSTableReader>, ephemeral boolean) : void from class org.apache.cassandra.db.ColumnFamilyStore"
"127","Extract Method","Extract Method private createPlatformToolProvider(targetPlatform NativePlatformInternal) : PlatformToolProvider extracted from public select(targetPlatform NativePlatformInternal) : PlatformToolProvider in class org.gradle.nativeplatform.toolchain.internal.gcc.AbstractGccCompatibleToolChain","https://github.com/gradle/gradle/commit/681dc6346ce3cf5be5c5985faad120a18949cee0","1","Extract Method private createPlatformToolProvider(targetPlatform NativePlatformInternal) : PlatformToolProvider extracted from public select(targetPlatform NativePlatformInternal) : PlatformToolProvider in class org.gradle.nativeplatform.toolchain.internal.gcc.AbstractGccCompatibleToolChain"
"128","Extract Method","Extract Method public use(ctx ParserRuleContext, sql String) : Integer extracted from public use(ctx HplsqlParser.Use_stmtContext) : Integer in class org.apache.hive.hplsql.Stmt","https://github.com/apache/hive/commit/92e98858e742bbb669ccbf790a71a618c581df21","2","Extract Method public use(ctx ParserRuleContext, sql String) : Integer extracted from public use(ctx HplsqlParser.Use_stmtContext) : Integer in class org.apache.hive.hplsql.Stmt
Change Parameter Type val : boolean to val : Boolean in method public stackPush(val Boolean) : void in class org.apache.hive.hplsql.Exec"
"129","Extract Method","Extract Method private checkInterfaceModifiers(ast DetailAST) : void extracted from public visitToken(ast DetailAST) : void in class com.puppycrawl.tools.checkstyle.checks.modifier.RedundantModifierCheck","https://github.com/checkstyle/checkstyle/commit/2f7481ee4e20ae785298c31ec2f979752dd7eb03","1","Extract Method private checkInterfaceModifiers(ast DetailAST) : void extracted from public visitToken(ast DetailAST) : void in class com.puppycrawl.tools.checkstyle.checks.modifier.RedundantModifierCheck"
"130","Extract Method","Extract Method private initTimeMap() : Map<String,Integer> extracted from public parameters() : Collection<Object[]> in class org.openhab.core.library.types.DateTimeTypeTest","https://github.com/openhab/openhab/commit/f25fa3ae35e4a60a2b7f79a88f14d46ce6cebf55","1","Extract Method private initTimeMap() : Map<String,Integer> extracted from public parameters() : Collection<Object[]> in class org.openhab.core.library.types.DateTimeTypeTest"
