"ID","Type","Description","Commit","Size/Commit","Others"
"0","Extract Method","Extract Method private showStatus(txt String) : void extracted from private showStatus(realm Realm) : void in class io.realm.examples.realmmigrationexample.MigrationExampleActivity","https://github.com/realm/realm-java/commit/6cf596df183b3c3a38ed5dd9bb3b0100c6548ebb","2","Extract Method private showStatus(txt String) : void extracted from private showStatus(realm Realm) : void in class io.realm.examples.realmmigrationexample.MigrationExampleActivity
Extract Variable realmMigration : RealmMigration in method public migrateRealm(configuration RealmConfiguration, migration RealmMigration) : void from class io.realm.Realm"
"1","Extract Method","Extract Method protected setMaxHeight(maxHeight int) : void extracted from protected wrapMenuBar(menuBar ToolbarMenuBar) : Widget in class org.rstudio.core.client.widget.ScrollableToolbarPopupMenu","https://github.com/rstudio/rstudio/commit/cb49e436b9d7ee55f2531ebc2ef1863f5c9ba9fe","1","Extract Method protected setMaxHeight(maxHeight int) : void extracted from protected wrapMenuBar(menuBar ToolbarMenuBar) : Widget in class org.rstudio.core.client.widget.ScrollableToolbarPopupMenu"
"2","Extract Method","Extract Method private addCoursesFromStepic(result List<CourseInfo>, pageNumber int) : boolean extracted from public getCourses() : List<CourseInfo> in class com.jetbrains.edu.stepic.EduStepicConnector","https://github.com/JetBrains/intellij-community/commit/7ed3f273ab0caf0337c22f0b721d51829bb0c877","2","Extract Method private addCoursesFromStepic(result List<CourseInfo>, pageNumber int) : boolean extracted from public getCourses() : List<CourseInfo> in class com.jetbrains.edu.stepic.EduStepicConnector
Extract Variable coursesContainer : CoursesContainer in method private addCoursesFromStepic(result List<CourseInfo>, pageNumber int) : boolean from class com.jetbrains.edu.stepic.EduStepicConnector"
"3","Extract Method","Extract Method private convertPemKeyPair(pemKeyPair PEMKeyPair) : KeyPair extracted from public loadKeys() : Iterable<KeyPair> in class org.crsh.auth.FilePublicKeyProvider","https://github.com/crashub/crash/commit/2801269c7e47bd6e243612654a74cee809d20959","2","Extract Method private convertPemKeyPair(pemKeyPair PEMKeyPair) : KeyPair extracted from public loadKeys() : Iterable<KeyPair> in class org.crsh.auth.FilePublicKeyProvider
Parameterize Variable keyPair : PEMKeyPair to pemKeyPair : PEMKeyPair in method private convertPemKeyPair(pemKeyPair PEMKeyPair) : KeyPair in class org.crsh.auth.FilePublicKeyProvider"
"4","Extract Method","Extract Method protected resolveFormEncoding() : String extracted from protected formBuffer() : Buffer in class jodd.http.HttpBase","https://github.com/oblac/jodd/commit/722ef9156896248ef3fbe83adde0f6ff8f46856a","2","Extract Method protected resolveFormEncoding() : String extracted from protected formBuffer() : Buffer in class jodd.http.HttpBase
Add Class Annotation @MultipartConfig in class jodd.http.Echo2Servlet"
"5","Extract Method","Extract Method private fetch(url String) : byte[] extracted from public fetch(feed Feed) : byte[] in class com.commafeed.backend.favicon.DefaultFaviconFetcher","https://github.com/Athou/commafeed/commit/18a7bd1fd1a83b3b8d1b245e32f78c0b4443b7a7","1","Extract Method private fetch(url String) : byte[] extracted from public fetch(feed Feed) : byte[] in class com.commafeed.backend.favicon.DefaultFaviconFetcher"
"6","Extract Method","Extract Method protected getProbe(prefix String) : Probe extracted from protected getLivenessProbe() : Probe in class io.fabric8.maven.JsonMojo","https://github.com/fabric8io/fabric8/commit/8127b21a220ca677c4e59961d019e7753da7ea6e","1","Extract Method protected getProbe(prefix String) : Probe extracted from protected getLivenessProbe() : Probe in class io.fabric8.maven.JsonMojo"
"7","Extract Method","Extract Method public getHTMLEditorKit(noGapsBetweenParagraphs boolean) : HTMLEditorKit extracted from public getHTMLEditorKit() : HTMLEditorKit in class com.intellij.util.ui.UIUtil","https://github.com/JetBrains/intellij-community/commit/138911ce88b05039242b8d1b2bb5b7a59008f5ee","1","Extract Method public getHTMLEditorKit(noGapsBetweenParagraphs boolean) : HTMLEditorKit extracted from public getHTMLEditorKit() : HTMLEditorKit in class com.intellij.util.ui.UIUtil"
"8","Extract Method","Extract Method private canBinaryExpressionBeUnboxed(lhs PsiExpression, rhs PsiExpression) : boolean extracted from private canBeUnboxed(expression PsiExpression) : boolean in class com.siyeh.ig.migration.UnnecessaryBoxingInspection.UnnecessaryBoxingVisitor","https://github.com/JetBrains/intellij-community/commit/cc0eaf7faa408a04b68e2b5820f3ebcc75420b5b","4","Extract Method private canBinaryExpressionBeUnboxed(lhs PsiExpression, rhs PsiExpression) : boolean extracted from private canBeUnboxed(expression PsiExpression) : boolean in class com.siyeh.ig.migration.UnnecessaryBoxingInspection.UnnecessaryBoxingVisitor
Move And Rename Method private isAnnotatedNotNull(expression PsiExpression) : boolean from class com.siyeh.ig.psiutils.SwitchUtils to private isAnnotated(expression PsiExpression, nullable boolean) : boolean from class com.siyeh.ig.psiutils.ExpressionUtils
Move And Rename Method private isAnnotatedNullable(expression PsiExpression) : boolean from class com.siyeh.ig.psiutils.SwitchUtils to private isAnnotated(expression PsiExpression, nullable boolean) : boolean from class com.siyeh.ig.psiutils.ExpressionUtils
Add Parameter nullable : boolean in method private isAnnotated(expression PsiExpression, nullable boolean) : boolean from class com.siyeh.ig.psiutils.ExpressionUtils"
"9","Extract Method","Extract Method private categorizeAnnotatedClass(annotatedClass Class, attributeConverterManager AttributeConverterManager) : void extracted from public AnnotationMetadataSourceProcessorImpl(sources MetadataSources, rootMetadataBuildingContext MetadataBuildingContextRootImpl, jandexView IndexView) in class org.hibernate.boot.model.source.internal.annotations.AnnotationMetadataSourceProcessorImpl","https://github.com/hibernate/hibernate-orm/commit/2b89553db5081fe4e55b7b34d636d0ea2acf71c5","5","Extract Method private categorizeAnnotatedClass(annotatedClass Class, attributeConverterManager AttributeConverterManager) : void extracted from public AnnotationMetadataSourceProcessorImpl(sources MetadataSources, rootMetadataBuildingContext MetadataBuildingContextRootImpl, jandexView IndexView) in class org.hibernate.boot.model.source.internal.annotations.AnnotationMetadataSourceProcessorImpl
Rename Variable annotateClass : Class to annotatedClass : Class in method public AnnotationMetadataSourceProcessorImpl(sources MetadataSources, rootMetadataBuildingContext MetadataBuildingContextRootImpl, jandexView IndexView) in class org.hibernate.boot.model.source.internal.annotations.AnnotationMetadataSourceProcessorImpl
Rename Variable clazz : Class to annotatedClass : Class in method public AnnotationMetadataSourceProcessorImpl(sources MetadataSources, rootMetadataBuildingContext MetadataBuildingContextRootImpl, jandexView IndexView) in class org.hibernate.boot.model.source.internal.annotations.AnnotationMetadataSourceProcessorImpl
Parameterize Variable annotateClass : Class to annotatedClass : Class in method private categorizeAnnotatedClass(annotatedClass Class, attributeConverterManager AttributeConverterManager) : void in class org.hibernate.boot.model.source.internal.annotations.AnnotationMetadataSourceProcessorImpl
Parameterize Variable clazz : Class to annotatedClass : Class in method private categorizeAnnotatedClass(annotatedClass Class, attributeConverterManager AttributeConverterManager) : void in class org.hibernate.boot.model.source.internal.annotations.AnnotationMetadataSourceProcessorImpl"
"10","Extract Method","Extract Method public addDependency(project Project, configurationName String, group String, name String, version String, classifier String, transitive boolean) : Dependency extracted from public addDependency(project Project, configurationName String, group String, name String, version String, transitive boolean) : Dependency in class com.liferay.gradle.util.GradleUtil","https://github.com/liferay/liferay-portal/commit/59fd9e696cec5f2ed44c27422bbc426b11647321","3","Extract Method public addDependency(project Project, configurationName String, group String, name String, version String, classifier String, transitive boolean) : Dependency extracted from public addDependency(project Project, configurationName String, group String, name String, version String, transitive boolean) : Dependency in class com.liferay.gradle.util.GradleUtil
Move Method public addDependency(project Project, configurationName String, group String, name String, version String, classifier String) : Dependency from class com.liferay.gradle.plugins.poshi.runner.util.GradleUtil to public addDependency(project Project, configurationName String, group String, name String, version String, classifier String, transitive boolean) : Dependency from class com.liferay.gradle.util.GradleUtil
Add Parameter transitive : boolean in method public addDependency(project Project, configurationName String, group String, name String, version String, classifier String, transitive boolean) : Dependency from class com.liferay.gradle.util.GradleUtil"
"11","Extract Method","Extract Method private cleanupProximityLocked() : void extracted from private cleanupProximity() : void in class com.android.server.power.PowerManagerService","https://github.com/CyanogenMod/android_frameworks_base/commit/96a2c3410f3c71d3ab20857036422f1d64c3a6d3","1","Extract Method private cleanupProximityLocked() : void extracted from private cleanupProximity() : void in class com.android.server.power.PowerManagerService"
"12","Extract Method","Extract Method public removeNodes(paths Collection<TreePath>) : void extracted from public removeNode(nodePath TreePath) : void in class com.intellij.compiler.options.AnnotationProcessorsPanel.MyTreeModel","https://github.com/JetBrains/intellij-community/commit/484038e916dc40bf87eca10c77889d79eca96c4d","2","Extract Method public removeNodes(paths Collection<TreePath>) : void extracted from public removeNode(nodePath TreePath) : void in class com.intellij.compiler.options.AnnotationProcessorsPanel.MyTreeModel
Rename Parameter parent : TreePath to path : TreePath in method public removeNode(path TreePath) : void in class com.intellij.util.ui.EditableTreeModel"
"13","Extract Method","Extract Method public setMpUniqueIdListener(listener DurableMpUniqueIdListener) : void extracted from public setMpDRGateway(mpGateway PartitionDRGateway) : void in class org.voltdb.iv2.SpScheduler","https://github.com/VoltDB/voltdb/commit/e9efc045fbc6fa893c66a03b72b7eedb388cf96c","1","Extract Method public setMpUniqueIdListener(listener DurableMpUniqueIdListener) : void extracted from public setMpDRGateway(mpGateway PartitionDRGateway) : void in class org.voltdb.iv2.SpScheduler"
"14","Extract Method","Extract Method public values(names List<String>, values List<Object>) : Insert extracted from public values(names String[], values Object[]) : Insert in class com.datastax.driver.core.querybuilder.Insert","https://github.com/datastax/java-driver/commit/3a0603f8f778be3219a5a0f3a7845cda65f1e172","1","Extract Method public values(names List<String>, values List<Object>) : Insert extracted from public values(names String[], values Object[]) : Insert in class com.datastax.driver.core.querybuilder.Insert"
"15","Extract Method","Extract Method public canonicalizePath(url String, baseUrl Url, baseUrlIsFile boolean) : String extracted from protected canonicalizeUrl(url String, baseUrl Url, trimFileScheme boolean, sourceIndex int, baseUrlIsFile boolean) : Url in class org.jetbrains.debugger.sourcemap.SourceResolver","https://github.com/JetBrains/intellij-community/commit/d71154ed21e2d5c65bb0ddb000bcb04ca5735048","1","Extract Method public canonicalizePath(url String, baseUrl Url, baseUrlIsFile boolean) : String extracted from protected canonicalizeUrl(url String, baseUrl Url, trimFileScheme boolean, sourceIndex int, baseUrlIsFile boolean) : Url in class org.jetbrains.debugger.sourcemap.SourceResolver"
"16","Extract Method","Extract Method protected setupMockMvc() : void extracted from public setUp() : void in class org.springframework.data.rest.webmvc.AbstractWebIntegrationTests","https://github.com/spring-projects/spring-data-rest/commit/b7cba6a700d8c5e456cdeffe9c5bf54563eab7d3","1","Extract Method protected setupMockMvc() : void extracted from public setUp() : void in class org.springframework.data.rest.webmvc.AbstractWebIntegrationTests"
"17","Extract Method","Extract Method private addEntityScanBeanPostProcessor(registry BeanDefinitionRegistry, packagesToScan Set<String>) : void extracted from public registerBeanDefinitions(importingClassMetadata AnnotationMetadata, registry BeanDefinitionRegistry) : void in class org.springframework.boot.orm.jpa.EntityScanRegistrar","https://github.com/spring-projects/spring-boot/commit/1cfc6f64f64353bc5530a8ce8cdacfc3eba3e7b2","2","Extract Method private addEntityScanBeanPostProcessor(registry BeanDefinitionRegistry, packagesToScan Set<String>) : void extracted from public registerBeanDefinitions(importingClassMetadata AnnotationMetadata, registry BeanDefinitionRegistry) : void in class org.springframework.boot.orm.jpa.EntityScanRegistrar
Change Return Type String[] to Set<String> in method private getPackagesToScan(metadata AnnotationMetadata) : Set<String> in class org.springframework.boot.orm.jpa.EntityScanRegistrar"
"18","Extract Method","Extract Method private getFullKey(path String, key String) : String extracted from private flatten(properties Properties, input Map<String,Object>, path String) : void in class org.springframework.boot.cloudfoundry.VcapApplicationListener","https://github.com/spring-projects/spring-boot/commit/20d39f7af2165c67d5221f556f58820c992d2cc6","5","Extract Method private getFullKey(path String, key String) : String extracted from private flatten(properties Properties, input Map<String,Object>, path String) : void in class org.springframework.boot.cloudfoundry.VcapApplicationListener
Rename Variable object : Object to item : Object in method private flatten(properties Properties, input Map<String,Object>, path String) : void in class org.springframework.boot.cloudfoundry.VcapApplicationListener
Inline Variable map : Map<String,Object> in method private flatten(properties Properties, input Map<String,Object>, path String) : void from class org.springframework.boot.cloudfoundry.VcapApplicationListener
Extract Variable itemKey : String in method private flatten(properties Properties, input Map<String,Object>, path String) : void from class org.springframework.boot.cloudfoundry.VcapApplicationListener
Add Method Annotation @SuppressWarnings(""unchecked"") in method private flatten(properties Properties, input Map<String,Object>, path String) : void from class org.springframework.boot.cloudfoundry.VcapApplicationListener"
"19","Extract Method","Extract Method private initTickerView() : void extracted from protected makeStatusBarView() : PhoneStatusBarView in class com.android.systemui.statusbar.phone.PhoneStatusBar","https://github.com/CyanogenMod/android_frameworks_base/commit/658a918eebcbdeb4f920c2947ca8d0e79ad86d89","1","Extract Method private initTickerView() : void extracted from protected makeStatusBarView() : PhoneStatusBarView in class com.android.systemui.statusbar.phone.PhoneStatusBar"
"20","Extract Method","Extract Method protected rewriteLinksInDocument(document ODocument, rewrite OIndex<OIdentifiable>) : void extracted from private rewriteLinksInDocument(document ODocument) : void in class com.orientechnologies.orient.core.db.tool.ODatabaseImport","https://github.com/orientechnologies/orientdb/commit/1089957b645bde069d3864563bbf1f7c7da8045c","1","Extract Method protected rewriteLinksInDocument(document ODocument, rewrite OIndex<OIdentifiable>) : void extracted from private rewriteLinksInDocument(document ODocument) : void in class com.orientechnologies.orient.core.db.tool.ODatabaseImport"
"21","Extract Method","Extract Method public from(dao Dao, obj Object, filter FieldFilter, ignoreNull boolean, ignoreZero boolean, ignoreDate boolean, ignoreId boolean, ignoreName boolean, ignorePk boolean) : Cnd extracted from public from(dao Dao, obj Object, filter FieldFilter) : Cnd in class org.nutz.dao.Cnd","https://github.com/nutzam/nutz/commit/6599c748ef35d38085703cf3bd41b9b5b6af5f32","2","Extract Method public from(dao Dao, obj Object, filter FieldFilter, ignoreNull boolean, ignoreZero boolean, ignoreDate boolean, ignoreId boolean, ignoreName boolean, ignorePk boolean) : Cnd extracted from public from(dao Dao, obj Object, filter FieldFilter) : Cnd in class org.nutz.dao.Cnd
Remove Method Annotation @SuppressWarnings({""rawtypes"",""unchecked""}) in method public from(dao Dao, obj Object, filter FieldFilter) : Cnd from class org.nutz.dao.Cnd"
"22","Extract Method","Extract Method public createGogsWebhook(kubernetes KubernetesClient, log Log, gogsUser String, gogsPwd String, repoName String, webhookUrl String, webhookSecret String) : boolean extracted from public execute() : void in class io.fabric8.maven.CreateGogsWebhook","https://github.com/fabric8io/fabric8/commit/9e61a71540da58c3208fd2c7737f793c3f81e5ae","2","Extract Method public createGogsWebhook(kubernetes KubernetesClient, log Log, gogsUser String, gogsPwd String, repoName String, webhookUrl String, webhookSecret String) : boolean extracted from public execute() : void in class io.fabric8.maven.CreateGogsWebhook
Modify Attribute Annotation @Parameter(property = ""fabric8.username"") to @Parameter(property = ""fabric8.gogsUsername"") in attribute protected username : String from class io.fabric8.maven.CreateBuildConfigMojo"
"23","Extract Method","Extract Method protected fireEvent(event DiscoveryEvent) : void extracted from protected onRemoteStatusChanged(oldStatus InstanceInfo.InstanceStatus, newStatus InstanceInfo.InstanceStatus) : void in class com.netflix.discovery.DiscoveryClient","https://github.com/Netflix/eureka/commit/1cacbe2ad700275bc575234ff2b32ee0d6493817","2","Extract Method protected fireEvent(event DiscoveryEvent) : void extracted from protected onRemoteStatusChanged(oldStatus InstanceInfo.InstanceStatus, newStatus InstanceInfo.InstanceStatus) : void in class com.netflix.discovery.DiscoveryClient
Extract Superclass com.netflix.discovery.DiscoveryEvent from class com.netflix.discovery.StatusChangeEvent"
"24","Extract Method","Extract Method protected onRemoteStatusChanged(oldStatus InstanceInfo.InstanceStatus, newStatus InstanceInfo.InstanceStatus) : void extracted from private updateInstanceRemoteStatus() : void in class com.netflix.discovery.DiscoveryClient","https://github.com/Netflix/eureka/commit/f6212a7e474f812f31ddbce6d4f7a7a0d498b751","2","Extract Method protected onRemoteStatusChanged(oldStatus InstanceInfo.InstanceStatus, newStatus InstanceInfo.InstanceStatus) : void extracted from private updateInstanceRemoteStatus() : void in class com.netflix.discovery.DiscoveryClient
Parameterize Variable currentRemoteInstanceStatus : InstanceInfo.InstanceStatus to newStatus : InstanceInfo.InstanceStatus in method protected onRemoteStatusChanged(oldStatus InstanceInfo.InstanceStatus, newStatus InstanceInfo.InstanceStatus) : void in class com.netflix.discovery.DiscoveryClient"
"25","Extract Method","Extract Method protected waitForCacheToStabilize(cache Cache<Object,Object>, cacheConfig Configuration) : void extracted from public perform(ctx InvocationContext) : Object in class org.infinispan.commands.CreateCacheCommand","https://github.com/infinispan/infinispan/commit/e3b0d87b3ca0fd27cec39937cb3dc3a05b0cfc4e","3","Extract Method protected waitForCacheToStabilize(cache Cache<Object,Object>, cacheConfig Configuration) : void extracted from public perform(ctx InvocationContext) : Object in class org.infinispan.commands.CreateCacheCommand
Extract Variable cacheTopology : CacheTopology in method protected waitForCacheToStabilize(cache Cache<Object,Object>, cacheConfig Configuration) : void from class org.infinispan.commands.CreateCacheCommand
Remove Parameter stateTransferManager : StateTransferManager in method public init(cacheManager EmbeddedCacheManager, stateTransferManager StateTransferManager) : void from class org.infinispan.commands.CreateCacheCommand"
"26","Extract Method","Extract Method private throttle(currTimeMillis long) : void extracted from public run() : void in class com.yahoo.ycsb.ClientThread","https://github.com/brianfrankcooper/YCSB/commit/0b024834549c53512ef18bce89f60ef9225d4819","3","Extract Method private throttle(currTimeMillis long) : void extracted from public run() : void in class com.yahoo.ycsb.ClientThread
Parameterize Variable st : long to currTimeMillis : long in method private throttle(currTimeMillis long) : void in class com.yahoo.ycsb.ClientThread
Extract Attribute public DEFAULT_RECORD_COUNT : String in class com.yahoo.ycsb.Client"
"27","Extract Method","Extract Method public getDevices() : List<IDevice> extracted from public adbCall(adbCallable AdbCallable) : boolean in class com.facebook.buck.android.AdbHelper","https://github.com/facebook/buck/commit/f26d234e8d3458f34454583c22e3bd5f4b2a5da8","1","Extract Method public getDevices() : List<IDevice> extracted from public adbCall(adbCallable AdbCallable) : boolean in class com.facebook.buck.android.AdbHelper"
"28","Extract Method","Extract Method package clearCallbacksAndListener() : void extracted from private checkCurrentDimens() : void in class com.bumptech.glide.request.target.ViewTarget.SizeDeterminer","https://github.com/bumptech/glide/commit/0d4b27952751de0caab01774048c3e0ec74824ce","1","Extract Method package clearCallbacksAndListener() : void extracted from private checkCurrentDimens() : void in class com.bumptech.glide.request.target.ViewTarget.SizeDeterminer"
"29","Extract Method","Extract Method public submitBackground(cfs ColumnFamilyStore, autoFill boolean) : List<Future<?>> extracted from public submitBackground(cfs ColumnFamilyStore) : List<Future<?>> in class org.apache.cassandra.db.compaction.CompactionManager","https://github.com/apache/cassandra/commit/ec52e77ecde749e7c5a483b26cbd8041f2a5a33c","1","Extract Method public submitBackground(cfs ColumnFamilyStore, autoFill boolean) : List<Future<?>> extracted from public submitBackground(cfs ColumnFamilyStore) : List<Future<?>> in class org.apache.cassandra.db.compaction.CompactionManager"
"30","Extract Method","Extract Method protected reset(animateTransition boolean) : void extracted from public reset() : void in class com.android.keyguard.KeyguardAbsKeyInputView","https://github.com/CyanogenMod/android_frameworks_base/commit/15fd4f9caea01e53725086e290d3b35ec4bd4cd9","1","Extract Method protected reset(animateTransition boolean) : void extracted from public reset() : void in class com.android.keyguard.KeyguardAbsKeyInputView"
"31","Extract Method","Extract Method public getTokenForLogging() : String extracted from public toString() : String in class com.zegoggles.smssync.auth.OAuth2Token","https://github.com/jberkel/sms-backup-plus/commit/c265bde2ace252bc1e1c65c6af93520e5994edd2","1","Extract Method public getTokenForLogging() : String extracted from public toString() : String in class com.zegoggles.smssync.auth.OAuth2Token"
"32","Extract Method","Extract Method package signatureBaseString(method String, uri Uri, oauthTimestamp long, nonce String, formParams List<Param>, queryParams List<Param>) : StringBuilder extracted from public calculateSignature(method String, uri Uri, oauthTimestamp long, nonce String, formParams List<Param>, queryParams List<Param>) : String in class org.asynchttpclient.oauth.OAuthSignatureCalculator","https://github.com/AsyncHttpClient/async-http-client/commit/f01d8610b9ceebc1de59d42f569b8af3efbe0a0f","1","Extract Method package signatureBaseString(method String, uri Uri, oauthTimestamp long, nonce String, formParams List<Param>, queryParams List<Param>) : StringBuilder extracted from public calculateSignature(method String, uri Uri, oauthTimestamp long, nonce String, formParams List<Param>, queryParams List<Param>) : String in class org.asynchttpclient.oauth.OAuthSignatureCalculator"
"33","Extract Method","Extract Method private handleInputStreamMessage(sourceFileInputStream InputStream, originalFile File, tempFile File, resultFile File) : File extracted from private handleFileMessage(sourceFile File, tempFile File, resultFile File) : File in class org.springframework.integration.file.FileWritingMessageHandler","https://github.com/spring-projects/spring-integration/commit/247232bdde24b81814a82100743f77d881aaf06b","3","Extract Method private handleInputStreamMessage(sourceFileInputStream InputStream, originalFile File, tempFile File, resultFile File) : File extracted from private handleFileMessage(sourceFile File, tempFile File, resultFile File) : File in class org.springframework.integration.file.FileWritingMessageHandler
Parameterize Variable bis : BufferedInputStream to sourceFileInputStream : InputStream in method private handleInputStreamMessage(sourceFileInputStream InputStream, originalFile File, tempFile File, resultFile File) : File in class org.springframework.integration.file.FileWritingMessageHandler
Change Variable Type bis : BufferedInputStream to sourceFileInputStream : InputStream in method private handleInputStreamMessage(sourceFileInputStream InputStream, originalFile File, tempFile File, resultFile File) : File in class org.springframework.integration.file.FileWritingMessageHandler"
